<!ELEMENT peliculas (pelicula*)>

<!ELEMENT pelicula (titulo, director, genero, year)>
<!ATTLIST pelicula id CDATA #IMPLIED>
<!ELEMENT titulo   (#PCDATA)>
<!ELEMENT director (#PCDATA)>
<!ELEMENT genero   (#PCDATA)>
<!ELEMENT year     (#PCDATA)>